<?xml version="1.0" encoding="UTF-8"?>
<xs:schema xmlns:xs="http://www.w3.org/2001/XMLSchema">
    <xs:element name="cars">
        <xs:complexType>
            <xs:sequence>
                <xs:element name="car" minOccurs="0" maxOccurs="unbounded">
                    <xs:complexType>
                        <xs:sequence>
                            <xs:element name="brand" type="xs:string"/>
                            <xs:element name="model" type="xs:string"/>
                            <xs:element name="year" type="xs:int"/>
                            <xs:element name="price" type="xs:decimal"/>
                            <xs:element name="engine" type="xs:string"/>
                            <xs:element name="color" type="xs:string"/>
                        </xs:sequence>
                    </xs:complexType>
                </xs:element>
            </xs:sequence>
        </xs:complexType>
    </xs:element>

</xs:schema>
